{
  "$schema": "http://json-schema.org/schema#",
  "additionalProperties": false,
  "defs": {
    "attribute": {
      "additionalProperties": false,
      "properties": {
        "categories": {
          "items": {
            "type": "string"
          },
          "type": "array",
          "uniqueItems": true
        },
        "description": {
          "type": "string"
        },
        "disable_correlation": {
          "type": "boolean"
        },
        "misp-attribute": {
          "type": "string"
        },
        "multiple": {
          "type": "boolean"
        },
        "recommended": {
          "type": "boolean"
        },
        "sane_default": {
          "items": {
            "type": "string"
          },
          "type": "array",
          "uniqueItems": true
        },
        "to_ids": {
          "type": "boolean"
        },
        "ui-priority": {
          "type": "number"
        },
        "values_list": {
          "items": {
            "type": "string"
          },
          "type": "array",
          "uniqueItems": true
        }
      },
      "required": [
        "misp-attribute",
        "ui-priority",
        "description"
      ],
      "type": "object"
    }
  },
  "id": "https://www.github.com/MISP/misp-objects/schema.json",
  "properties": {
    "attributes": {
      "additionalProperties": {
        "$ref": "#/defs/attribute",
        "type": "object"
      },
      "type": "object"
    },
    "description": {
      "type": "string"
    },
    "meta-category": {
      "enum": [
        "file",
        "network",
        "financial",
        "misc",
        "internal",
        "vulnerability",
        "climate"
      ],
      "type": "string"
    },
    "name": {
      "type": "string"
    },
    "required": {
      "items": {
        "type": "string"
      },
      "type": "array",
      "uniqueItems": true
    },
    "requiredOneOf": {
      "items": {
        "type": "string"
      },
      "type": "array",
      "uniqueItems": true
    },
    "uuid": {
      "type": "string"
    },
    "version": {
      "type": "integer"
    }
  },
  "required": [
    "attributes",
    "version",
    "description",
    "meta-category",
    "name",
    "uuid"
  ],
  "title": "Validator for misp-objects",
  "type": "object"
}
