{
  "requiredOneOf": [
    "attachment",
    "archive",
    "narrative-summary"
  ],
  "attributes": {
    "5Ds-of-propaganda": {
      "description": "5 D's of propaganda are tactics of rebuttal used to defend against criticism and adversarial narratives.",
      "ui-priority": 1,
      "misp-attribute": "text",
      "disable_correlation": true,
      "multiple": true,
      "values_list": [
        "dismiss",
        "distort",
        "distract",
        "dismay",
        "divide"
      ]
    },
    "attachment": {
      "description": "Documents related to the narrative.",
      "ui-priority": 1,
      "misp-attribute": "attachment"
    },
    "narrative-disproof": {
      "description": "Disproof or evidence against the narrative.",
      "disable_correlation": true,
      "ui-priority": 1,
      "misp-attribute": "text"
    },
    "narrative-summary": {
      "description": "A summary of the narrative.",
      "ui-priority": 1,
      "misp-attribute": "text"
    },
    "external-references": {
      "description": "Link to external references.",
      "disable_correlation": true,
      "ui-priority": 1,
      "misp-attribute": "link"
    },
    "link": {
      "description": "Original link to the narrative source (Supposed harmless)",
      "ui-priority": 1,
      "misp-attribute": "link"
    },
    "url": {
      "description": "Original link to the narrative source (Supposed malicious)",
      "ui-priority": 1,
      "misp-attribute": "url"
    },
    "archive": {
      "description": "Archive of the original narrative source (Internet Archive, Archive.is, etc).",
      "disable_correlation": true,
      "ui-priority": 1,
      "multiple": true,
      "misp-attribute": "link"
    },
    "objective": {
      "description": "Objective of the narrative.",
      "ui-priority": 1,
      "misp-attribute": "text",
      "disable_correlation": true,
      "multiple": true,
      "sane_default": [
        "Disinformation",
        "Advertising",
        "Parody",
        "Other"
      ]
    }
  },
  "version": 4,
  "description": "Object describing a narrative.",
  "meta-category": "misc",
  "uuid": "83bea299-514a-4719-a84b-f6fd0997fac1",
  "name": "narrative"
}
