{
    "required": [
      "key",
      "BHO-name"
    ],
    "attributes": {
      "key": {
        "description": "Software hive key where the information is retrieved from.",
        "ui-priority": 0,
        "misp-attribute": "text"
      },
      "last-write-time": {
        "description": "Date and time when the key was last updated.",
        "ui-priority": 0,
        "misp-attribute": "datetime"
      },
      "BHO-name": {
        "description": "Name of the browser helper object.",
        "ui-priority": 0,
        "misp-attribute": "text"
      },
      "BHO-key-last-write-time": {
        "description": "Date and time when the BHO key was last updated.",
        "ui-priority": 0,
        "misp-attribute": "datetime"
      },
      "class": {
        "description": "Class to which the BHO belongs to.",
        "ui-priority": 0,
        "misp-attribute": "text"
      },
      "module": {
        "description": "DLL module the BHO belongs to.",
        "ui-priority": 0,
        "misp-attribute": "text"
      },
      "comments": {
        "description": "Additional comments.",
        "ui-priority": 0,
        "misp-attribute": "text"
      },
      "references": {
        "description": "References to the BHO.",
        "ui-priority": 0,
        "misp-attribute": "links",
        "multiple":true
      }
    },
    "version": 1,
    "description": "Regripper Object template designed to gather information of the browser helper objects installed on the system.",
    "meta-category": "misc",
    "uuid": "e7b46b5a-d2d2-4a05-bc25-2ac8d4683ae2",
    "name": "regripper-software-hive-BHO"
  }
  